name,number_of_reviews,review_scores_value,cancellation_policy,host_id,host_name,host_for_x_days,host_response_time,host_response_rate,host_is_superhost,property_type,room_type,price,security_deposit,cleaning_fee,minimum_nights,maximum_nights
lovely sunny room in Boston,18,8,2,212445,Emma,4040,within an hour,100,0,Apartment,Private room,65,300,50,1,1125
Brownstone Cozy Private Studio,163,9,2,11228809,Jonathan,2804,within a few hours,100,0,Apartment,Entire home/apt,135,350,25,2,1125
Large Sunny room in Boston,9,9,2,212445,Emma,4040,within an hour,100,0,Apartment,Private room,65,300,50,3,180
Modern living in a conveniently located brownstone,4,10,2,5654336,Bill,3095,within an hour,100,0,Apartment,Entire home/apt,125,300,50,2,1125
"Small Rm, Renovated House, EZ to Downtown/Longwood",1,10,3,18517776,Huggy,2614,within a day,93,0,Apartment,Private room,33,300,50,30,1125
Private room in Boston,3,8,1,76032537,Chuyang,1929,within a few hours,100,0,Apartment,Private room,52,100,10,1,1125
Wonderful Boston apartment- 8 people,5,8,3,39932301,Ilan,2241,within an hour,100,0,Apartment,Entire home/apt,236,250,100,1,1125
Desirable 3 Bed/2 Bath in South End,60,9,3,1444340,Will,3582,within a day,98,0,Apartment,Entire home/apt,330,500,125,2,1125
3 bedroom Garden Apt in South End,43,9,3,1444340,Will,3582,within a day,98,0,Apartment,Entire home/apt,300,500,125,2,1125
Boston Executive Whole Apartment,34,8,2,9663343,Sarah,2881,within an hour,100,0,Apartment,Entire home/apt,179,100,20,1,1125
Spacious 2 family w/Room to Spare,88,9,3,841314,Kathe/Fanny/Candice,3712,within a few hours,90,0,House,Private room,60,100,20,3,365
"Charming urban studio, free parking",82,10,2,25742899,Tyree,2444,within a day,90,0,House,Entire home/apt,110,100,30,1,365
Garden Apt - Highland Park/Fort Hill (Orange Line),7,10,1,22901863,Ziyad,2520,within an hour,100,0,Apartment,Entire home/apt,114,250,35,2,90
Parking EZ 2 Downtown/Longwood Larg,4,10,3,18517776,Huggy,2614,within a day,93,0,Apartment,Private room,39,300,50,30,1125
Brownstone Custom Bedroom,14,10,2,11228809,Jonathan,2804,within a few hours,100,0,Apartment,Private room,95,400,25,2,1125
3BR/1.5BA + Prvt Patio - Boston,24,9,2,20113039,Yilkal,2588,within an hour,100,0,Apartment,Entire home/apt,269,500,199,1,1125
Stylish 2BR in Lower Roxbury,2,9,3,12243051,Flatbook,2771,within a few hours,71,0,Apartment,Entire home/apt,229,400,95,3,1125
Elegant Urban Art-Filled Victorian,105,9,3,807320,Kate,3720,within a day,100,0,House,Entire home/apt,150,500,80,2,5
Chic 3BR in Lower Roxbury,3,10,3,12243051,Flatbook,2771,within a few hours,71,0,Apartment,Entire home/apt,229,400,95,3,1125
Brownstone Modern Bedroom ,78,10,2,11228809,Jonathan,2804,within a few hours,100,0,Apartment,Private room,92,400,25,2,1125
Brownstone Master Bedroom Suite,85,10,2,11228809,Jonathan,2804,within a few hours,100,0,Apartment,Private room,125,400,25,2,1125
Brownstone Serene Guest BR/Bath,31,9,2,45824409,Jonathan,2173,within a day,100,0,Townhouse,Private room,90,250,20,3,1125
Splendid Tremont St. 1 bedroom,65,8,3,1444340,Will,3582,within a day,98,0,Apartment,Entire home/apt,163,500,100,2,1125
Private room in Boston,25,9,2,212445,Emma,4040,within an hour,100,0,Apartment,Private room,65,300,50,3,400
Parking Close 2 Downtown Renovated,4,9,3,18517776,Huggy,2614,within a day,93,0,Apartment,Private room,40,300,50,30,1500
4 Beds 2 Baths in Luxury Brownstone,1,8,2,11228809,Jonathan,2804,within a few hours,100,0,Apartment,Entire home/apt,625,1200,150,2,1125
High ceiling studio in the South End,3,10,1,20322644,Katherine,2584,within a few hours,100,0,Apartment,Entire home/apt,200,200,50,2,1125
Brownstone Cozy Penthouse Suite,38,10,2,45824409,Jonathan,2173,within a day,100,0,Apartment,Private room,90,250,20,3,1125
Cozy Rm EZ St Parking EZ 2 downtown,3,9,3,18517776,Huggy,2614,within a day,93,0,Apartment,Private room,35,300,50,30,2000
Classic 1 bedroom in South End,63,8,3,1444340,Will,3582,within a day,98,0,Apartment,Entire home/apt,167,500,100,2,1125
1 Bedroom in Historic South End,2,10,1,51189915,Lindsey,2104,within a few hours,100,0,Apartment,Entire home/apt,150,200,50,2,5
Brownstone Loft Bedroom,40,9,2,11228809,Jonathan,2804,within a few hours,100,0,Apartment,Private room,81,400,25,2,1125
Gorgeous South End 2 Bed/1.5 Bath,42,9,3,1444340,Will,3582,within a day,98,0,Apartment,Entire home/apt,250,500,125,2,1125
Sensational South End 2 bedroom,111,9,3,5408229,Liesl,3112,within an hour,100,0,Apartment,Entire home/apt,255,100,80,2,1125
Living Room in ♥︎ of Boston,29,9,3,2254462,Ce,3426,within a few hours,100,0,Apartment,Shared room,75,1500,60,1,1
Fantastic 2 bed/1.5 bath South End,9,8,3,1444340,Will,3582,within a day,98,0,Apartment,Entire home/apt,250,500,125,2,1125
Stylish South End Apartment,27,9,3,35331408,Yoshika,2292,within an hour,100,0,Apartment,Entire home/apt,215,250,50,2,1125
1 Bedroom in large Condominium (II),26,10,2,43217109,Javier,2206,within an hour,100,0,Condominium,Private room,125,180,50,2,1125
Very Rare Luxury New Three Bedroom,34,9,3,47889779,Kyle,2146,within an hour,86,0,Apartment,Entire home/apt,373,300,150,2,1125
Rare Luxury Three Bedroom in New Building,1,8,3,6103953,Josh,3065,within an hour,100,0,Apartment,Entire home/apt,525,500,150,2,1125
"Luxe 2BR w/ Skyline Views, Gym",18,9,3,12243051,Flatbook,2771,within a few hours,71,0,Condominium,Entire home/apt,299,400,75,3,1125
Sleek Downtown 1BR by T w/Pool,4,9,3,12243051,Flatbook,2771,within a few hours,71,0,Condominium,Entire home/apt,269,400,95,3,1125
"Luxe 1BR in South End w/ Gym, Pool",20,10,3,12243051,Flatbook,2771,within a few hours,71,0,Apartment,Entire home/apt,189,400,80,3,1125
TRUE South End PERFECT!!!!,22,9,2,22110106,Chris,2539,within an hour,100,0,Apartment,Entire home/apt,215,300,50,1,60
2BR South End Condo w/Big Windows,19,10,3,12243051,Flatbook,2771,within a few hours,71,0,Condominium,Entire home/apt,279,400,95,3,1125
"Luxe South End 1BR w/ Pool, Gym",14,10,3,12243051,Flatbook,2771,within a few hours,71,0,Condominium,Entire home/apt,289,400,75,3,1125
Coolest new building in Boston,51,9,2,6103953,Josh,3065,within an hour,100,0,Apartment,Entire home/apt,154,300,90,2,1125
Really Cool Lux Building in Boston,42,10,2,47889779,Kyle,2146,within an hour,86,0,Apartment,Entire home/apt,236,250,99,2,1125
Parlor South End charm with deck,54,9,3,38611099,Vika,2255,within a few hours,100,0,Apartment,Entire home/apt,175,250,80,2,90
Lux City Pad 2/2 with huge terrace!,57,9,2,6103953,Josh,3065,within an hour,100,0,Apartment,Entire home/apt,234,300,99,1,1125
Sleek 2BR w/ Expansive Views & Pool,29,9,3,12243051,Flatbook,2771,within a few hours,71,0,Apartment,Entire home/apt,329,400,100,3,1125
Brand New Luxury 1BR in South End,1,8,3,12243051,Flatbook,2771,within a few hours,71,0,Apartment,Entire home/apt,209,400,95,3,1125
Charming and Bright South End Apt,56,9,2,912631,Gregory,3698,within a few hours,100,0,Apartment,Entire home/apt,195,250,60,3,90
Upscale 1BR w/ Skyline Views,1,10,3,12243051,Flatbook,2771,within a few hours,71,0,Apartment,Entire home/apt,169,400,95,3,1125
Efficient Studio - Back Bay/ S. End,12,8,3,1444340,Will,3582,within a day,98,0,Apartment,Entire home/apt,138,500,75,2,1125
Penthouse South End with roof deck,35,9,3,19013294,Viktoria,2607,within an hour,100,0,Apartment,Entire home/apt,195,250,50,2,1125
Quiet 2 bedroom South End Condo,2,10,3,56744818,Bridget,2056,within an hour,100,0,Condominium,Entire home/apt,250,100,60,2,1125
Stylish South End 1BR by Flatbook,14,9,3,12243051,Flatbook,2771,within a few hours,71,0,Condominium,Entire home/apt,199,400,95,3,1125
South End Brownstone 1bd/1ba,11,9,2,2405780,Erin,3408,within a day,92,0,Apartment,Entire home/apt,185,150,75,3,1125
Spacious S. End 1BD Brownstone,39,9,3,7964081,Gabriella,2964,within an hour,100,0,Apartment,Entire home/apt,175,150,25,1,1125
Private & Spacious South End Suite,4,10,2,90491687,John,1856,within an hour,100,0,Condominium,Private room,125,100,30,1,90
"South End, sunny, quiet, 1 bedroom condo",1,10,1,10757098,Kit,2825,within a few hours,100,0,Apartment,Entire home/apt,150,500,50,5,120
Sunny South End Brownstone,42,10,2,16681075,Sean,2654,within an hour,100,0,Apartment,Entire home/apt,265,500,55,2,1125
"Parlor Retreat, South End studio",15,9,3,5430185,Laura,3110,within an hour,100,0,Apartment,Entire home/apt,160,400,200,32,1125
Modern Duplex in South End,20,10,3,4776690,Dan,3161,within an hour,100,0,Apartment,Entire home/apt,99,400,75,2,1125
Sunny Studio in Heart of South End,8,10,1,42868503,Thiago,2210,within a day,80,0,Apartment,Entire home/apt,125,200,45,1,1125
Beautiful South End Penthouse!,66,10,3,20627610,Liri,2577,within a few hours,100,0,Apartment,Entire home/apt,235,200,70,2,1125
Sunny studio in Back Bay/So. End,55,9,3,814298,Brent,3718,within a few hours,98,0,Apartment,Entire home/apt,100,500,75,2,1125
New 1 Bed Flat - South End,39,9,3,814298,Brent,3718,within a few hours,98,0,Apartment,Entire home/apt,164,500,100,3,365
South End townhouse apt with deck,37,9,3,38611099,Vika,2255,within a few hours,100,0,Apartment,Entire home/apt,185,250,80,2,30
Ideal studio in the Back Bay/S. End,21,8,3,814298,Brent,3718,within a few hours,98,0,Apartment,Entire home/apt,225,500,75,2,1125
Cozy South End Apt in best location,6,10,3,22543302,Christopher,2529,within an hour,100,0,Condominium,Entire home/apt,115,100,35,4,1125
South End Studio with Sleeping Loft,18,9,2,2212661,Lauren,3432,within an hour,100,0,Apartment,Entire home/apt,170,200,40,4,365
Bright 2BR in Heart of South End,9,7,3,12243051,Flatbook,2771,within a few hours,71,0,Apartment,Entire home/apt,229,400,95,3,1125
"Views, Amenities, Location, Bingo!",11,10,3,3958442,Jp,3250,within a few hours,100,0,Apartment,Entire home/apt,200,250,40,1,1125
Efficient Studio - Back Bay/S. End,39,8,3,814298,Brent,3718,within a few hours,98,0,Apartment,Entire home/apt,100,500,75,2,1125
2Bed2BathDplx 43Bus to BestBosSites,192,10,3,1651480,Edward,3522,within an hour,100,0,Apartment,Entire home/apt,306,150,90,1,85
Bright & beautiful 2BR in best location,5,10,3,7744251,Lisa,2974,within a day,80,0,Apartment,Entire home/apt,229,250,80,3,60
Stylish 1BR in Heart of Boston,4,10,3,12243051,Flatbook,2771,within a few hours,71,0,Condominium,Entire home/apt,199,400,95,3,1125
Trendy Loft in the South End,31,9,3,2883829,George,3356,within an hour,100,0,Apartment,Entire home/apt,225,500,80,2,1125
Romantic B&B - Roof Top Hot Tub,4,10,3,97805,Stephen,4195,within an hour,100,0,Bed & Breakfast,Private room,168,1000,25,1,1125
"1Studio WalkOutToPatio..CloseToBus,T,HistoricSites",192,9,3,1651480,Edward,3522,within an hour,100,0,Apartment,Entire home/apt,183,100,70,2,365
Sleek and Modern in the South End,115,9,3,1015632,Kevin,3676,within an hour,100,0,Apartment,Entire home/apt,190,250,50,2,1125
"Elegant, Historic, sleek renovation",6,10,3,2265368,Daniel,3425,within a few hours,100,0,Apartment,Entire home/apt,210,375,50,4,100
Comfort and peace in the South End.,6,9,1,25124470,Alice,2459,within an hour,100,0,Condominium,Entire home/apt,600,200,125,1,1125
Chic minimal 2BD in south end SOWA,8,9,3,7119092,Prasun,3005,within a few hours,100,0,Apartment,Entire home/apt,149,250,100,1,1125
Sunny Roofdeck Apartment,87,9,2,27015747,Ashley  &  Dennis,2420,within an hour,92,0,Apartment,Private room,150,200,25,2,21
1 BR / 1 BA Penthouse - South End,3,9,1,61279591,Mike,2024,within a few hours,100,0,Apartment,Entire home/apt,200,200,25,1,1125
S.END: Huge industrial cool condo!!,30,10,2,51741798,Jen,2098,within a few hours,100,0,Apartment,Entire home/apt,170,200,50,2,1125
"zzEastPrivateBedBath MinsToBus,Metro,HistoricSites",96,9,3,1651480,Edward,3522,within an hour,100,0,Apartment,Private room,157,150,45,2,90
1 Bedroom in Condominium (III),15,10,2,43217109,Javier,2206,within an hour,100,0,Condominium,Private room,110,180,50,2,1125
Luxurious penthouse living!!,19,10,3,36559227,Justin,2277,within an hour,100,0,Townhouse,Entire home/apt,575,500,125,2,7
"Boston, South End - 1 Bedroom (I)",19,10,2,43217109,Javier,2206,within an hour,100,0,Condominium,Private room,110,180,50,2,1125
Historical Southend apartment,38,10,3,14535919,Paul,2705,within a few hours,100,0,Apartment,Entire home/apt,200,250,100,3,1125
Marvelous South End 2.5 bed/ 2.5 ba,39,9,3,814298,Brent,3718,within a few hours,98,0,Apartment,Entire home/apt,417,500,135,4,1125
Stunning SouthEnd/BackBay Penthouse,38,10,3,21609039,Susan,2552,within an hour,100,0,Condominium,Entire home/apt,600,500,80,2,180
3Bed/2.5Bath Luxury Triplex So. End,26,9,3,9485021,Stacy,2891,within a few hours,100,0,Apartment,Entire home/apt,800,1000,200,5,1125
"Boston, South End - 3 Bedrooms",1,8,2,43217109,Javier,2206,within an hour,100,0,Condominium,Entire home/apt,299,400,175,4,1125
"Victorian Charm, Modern Living: South End/Back Bay",1,10,2,34055750,Philip And Ann,2308,within a few hours,100,0,Condominium,Entire home/apt,275,500,99,2,1125
Safe Clean Convenient ♥ Heart of Boston,55,9,3,2254462,Ce,3426,within a few hours,100,0,Apartment,Private room,99,1500,65,2,1125
South End Beauty/1+ beds/1.5 baths,2,10,2,52081526,Thomas,2094,within a few hours,100,0,Apartment,Entire home/apt,250,250,30,3,1125
Large 2 Bedrooms Boston South End,3,8,3,4897723,Sina,3152,within a day,100,0,Apartment,Entire home/apt,200,800,80,1,1125
Boston Centrally Located Brownstone,29,10,3,66371429,Eve,1987,within a few hours,100,0,Apartment,Private room,119,299,39,1,1125
"Victorian Dream Studio, South End",19,9,3,5430185,Laura,3110,within an hour,100,0,Apartment,Entire home/apt,170,400,200,32,1125
Nice South End Condo.,24,10,3,29806038,Jason,2370,within a few hours,100,0,Apartment,Entire home/apt,225,200,60,2,30
Ideal Studio in Back Bay/S. End,13,8,3,1444340,Will,3582,within a day,98,0,Apartment,Entire home/apt,144,500,75,2,1125
Modern studio in Boston’s South End,2,10,3,2976895,Abdin,3347,within a few hours,100,0,Apartment,Entire home/apt,170,300,60,4,20
"zWestPrivateBedBath MinsToBus,Metro",21,9,3,1651480,Edward,3522,within an hour,100,0,Apartment,Private room,217,150,45,2,87
Fashionable South End Condo,26,9,1,43449123,Patrick,2203,within an hour,100,0,Apartment,Entire home/apt,240,250,100,2,1125
Serene in the South End,8,8,3,5430185,Laura,3110,within an hour,100,0,Apartment,Entire home/apt,160,400,200,27,1100
1 bedroom apt in Boston South End,24,10,3,44392534,Nick,2191,within a few hours,100,0,Apartment,Entire home/apt,175,1000,50,1,1125
South End studio with private patio,13,10,2,49104276,Dan & Daniela,2132,within a few hours,100,0,Apartment,Entire home/apt,228,750,25,2,5
"South End Private Garden, Free Parking",3,9,3,41661623,Christopher,2223,within an hour,100,0,Apartment,Entire home/apt,161,200,50,2,1125
South End Artist Loft in SOWA,4,7,3,271917,Sheryl,3978,within a few hours,100,0,Condominium,Entire home/apt,300,1000,125,2,1125
Cool Boston Crib. Awesome Building,27,9,2,6103953,Josh,3065,within an hour,100,0,Apartment,Entire home/apt,177,300,99,2,1125
"Boutique South End, with sunshine",16,9,3,5430185,Laura,3110,within an hour,100,0,Apartment,Entire home/apt,185,400,200,32,365
Boston South End - Multiple Rooms,3,9,2,43217109,Javier,2206,within an hour,100,0,Condominium,Private room,125,180,50,2,1125
Fantastic 2 bed South End duplex!,3,10,2,26164941,Paul,2436,within a day,100,0,Apartment,Entire home/apt,150,100,100,1,1125
Sunny Studio in Back Bay/ S. End,20,8,3,1444340,Will,3582,within a day,98,0,Apartment,Entire home/apt,122,500,75,2,1125
2 BR Apt Boston South End,4,10,3,4897723,Sina,3152,within a day,100,0,Apartment,Entire home/apt,200,600,80,1,1125
"Great Spot - South End, 2 BR Condo",3,10,1,64837202,Kim,1998,within a day,100,0,Condominium,Entire home/apt,350,500,60,2,1125
Stay in the heart of South End!,62,10,2,7422781,Christine,2989,within a few hours,100,0,Apartment,Entire home/apt,80,100,40,1,7
"BMC, Symphony T, NE, BU, Berklee!!",22,10,3,21184200,Paige,2563,within an hour,99,0,Apartment,Entire home/apt,188,199,65,2,1125
South End 1 Bedroom PERFECTION!,16,9,2,22110106,Chris,2539,within an hour,100,0,Apartment,Entire home/apt,215,300,50,1,1125
Brownstone on Charming Dead End St.,8,10,3,32870796,Jessica,2324,within a few hours,90,0,Apartment,Entire home/apt,300,500,50,2,300
Classic Boston Brownstone,9,10,3,10115868,Dave,2858,within an hour,100,0,Apartment,Entire home/apt,250,250,50,3,1125
"Private Roof-Deck, South End PH Apt",6,10,3,28972872,Marc,2384,within an hour,100,0,Apartment,Entire home/apt,200,250,65,1,1125
Great room in Boston's South End,6,9,3,4897723,Sina,3152,within a day,100,0,Apartment,Private room,119,200,15,1,1125
Best Location in Boston (Copley Sq),18,9,2,22891260,Petar,2520,within an hour,100,0,Apartment,Entire home/apt,200,400,60,2,8
Luxury One Bed in Coolest Building!,43,9,2,47889779,Kyle,2146,within an hour,86,0,Apartment,Entire home/apt,130,250,99,2,1125
One Bedroom Parlor Townhouse,4,7,1,53603592,Ingrid,2080,within a few hours,70,0,House,Entire home/apt,220,150,100,1,1125
Gorgeous 2Bed in Historic South End,5,10,2,22288672,Heather,2535,within a day,100,0,Condominium,Entire home/apt,280,500,100,2,1125
Classic 2 Bed/1.5 Bath in South End,37,9,3,1444340,Will,3582,within a day,98,0,Apartment,Entire home/apt,235,500,125,2,1125
Bright 1BR in South End w/ Pool+Gym,12,9,3,12243051,Flatbook,2771,within a few hours,71,0,Condominium,Entire home/apt,189,400,95,3,1125
Top of the South End Brownstone,40,9,2,1592221,Sarah,3537,within a day,90,0,Apartment,Entire home/apt,250,500,100,2,1125
3BR Historic South End Penthouse,2,10,3,17219748,Cecilie,2641,within an hour,100,0,Apartment,Entire home/apt,650,1000,150,2,1125
Classic & Stylish w/ Balcony,3,10,3,4195134,LifestyleFurnishedApartments,3223,within a day,70,0,Apartment,Entire home/apt,110,1000,150,60,365
Drop Dead Gorgeous Spacious Studio,4,9,3,4195134,LifestyleFurnishedApartments,3223,within a day,70,0,Apartment,Entire home/apt,130,1500,150,5,1125
"Very spacious Back Bay, 1 block T",26,8,3,21184200,Paige,2563,within an hour,99,0,Apartment,Entire home/apt,155,150,55,1,1125
Stylish Studio in Historic Back Bay,4,10,1,6742925,Danielle,3026,within a few hours,90,0,Apartment,Entire home/apt,200,275,50,1,2
Stylish Studio in heart of Back Bay,75,10,2,7178644,Julie,3001,within a few hours,100,0,Apartment,Entire home/apt,174,325,20,1,8
Posh Studio on Bustling Newbury St,21,10,3,12243051,Flatbook,2771,within a few hours,71,0,Apartment,Entire home/apt,199,300,75,3,1125
Sparkling New 2BR / 2BA in Back Bay,83,9,3,9410008,Jason,2895,within an hour,100,0,Apartment,Entire home/apt,425,500,125,3,60
Stylish Studio in Elegant Back Bay,17,9,3,12243051,Flatbook,2771,within a few hours,71,0,Apartment,Entire home/apt,199,400,75,3,1125
3BR / 2BA + Prvt Deck in Back Bay,95,9,3,9410008,Jason,2895,within an hour,100,0,Apartment,Entire home/apt,695,600,150,3,60
Adorable 1Bd Apt in Busy Back Bay,7,9,3,58356283,Sophia,2044,within a few hours,90,0,Apartment,Entire home/apt,225,95,25,1,18
IDEAL LOCATION - 1BR/1BA NEWBURY ST,20,9,2,3713069,Lea,3273,within a few hours,92,0,Apartment,Private room,105,100,50,1,1125
Ahh the Views! 1 Bed with Balcony,5,9,3,4195134,LifestyleFurnishedApartments,3223,within a day,70,0,Apartment,Entire home/apt,175,1500,150,21,365
Quaint Renovated Rowhouse,85,9,2,20582119,Jeff,2578,within an hour,100,0,Apartment,Entire home/apt,180,100,60,1,1125
Back Bay 345,8,9,3,3521413,Elly,3293,within a few hours,100,0,Condominium,Entire home/apt,189,300,150,30,1125
Large 1 Bedroom on St. Botolph,12,10,2,1798561,Jonathan,3493,within a day,100,0,Apartment,Entire home/apt,165,300,85,3,21
"Large, Bright 2 Bedroom in Back Bay",25,9,2,206505,Cecile,4046,within a few hours,100,0,Apartment,Entire home/apt,375,300,35,2,3
"Back Bay, Newbury St. 1BR",31,8,3,65268598,Rob,1995,within an hour,100,0,Apartment,Entire home/apt,163,300,65,1,1125
Back Bay Gem 2,43,10,3,47618394,Liesl,2150,within an hour,100,0,Apartment,Entire home/apt,165,200,60,2,29
Stylish studio in prime Back Bay!,11,9,3,8008692,Randy,2962,within a few hours,100,0,Apartment,Entire home/apt,250,300,75,3,1125
Modern Comfort with Amazing Views,2,10,3,4195134,LifestyleFurnishedApartments,3223,within a day,70,0,Apartment,Entire home/apt,99,1500,150,90,365
Swanky Studio in Historic Back Bay,11,9,3,12243051,Flatbook,2771,within a few hours,71,0,Apartment,Entire home/apt,209,400,95,3,1125
Comfortable and Casual Copely Home,68,9,3,16779145,Elizabeth,2651,within an hour,95,0,Apartment,Entire home/apt,200,200,50,1,1125
"BACK BAY, MIT, BU, Green Line, BEST",20,9,3,21184200,Paige,2563,within an hour,99,0,Apartment,Entire home/apt,105,99,55,3,1125
Superb 1BR Back Bay Condo,7,10,3,28358624,Len,2395,within a day,90,0,Condominium,Entire home/apt,250,200,50,1,29
Stylish Back Bay Studio,9,10,2,39051883,Gretchen,2250,within a few hours,100,0,Apartment,Entire home/apt,105,500,150,4,365
Back Bay Studio - PrudentialCenter/Copley/Symphony,3,9,3,3041265,Humberto,3341,within an hour,100,0,Apartment,Entire home/apt,145,95,20,2,10
Back Bay Pied a Terre. Fabulous location!,1,10,2,16708213,Leigh Ann,2653,within a few hours,100,0,Condominium,Entire home/apt,170,350,55,2,1125
Live Local- Elegant Boston Brownstone.,4,10,3,76562235,Safia,1926,within a few hours,100,0,Apartment,Entire home/apt,329,1000,100,1,1125
Entire home w/patio -best location,7,8,3,10132799,Ezra,2858,within a day,100,0,Apartment,Entire home/apt,139,200,24,2,1125
Charming south end brownstone,13,10,2,44792241,Lisa,2187,within an hour,100,0,Apartment,Entire home/apt,196,200,90,1,1125
Back Bay-Ctr BOSTON-Lge Rm Pvt Bath,42,9,3,1984434,Irene,3466,within a few hours,100,0,House,Private room,120,500,60,5,365
Private Boston-Back Bay Top Floor w/ Private Deck,3,9,2,51745385,Dennis,2098,within an hour,100,0,Apartment,Entire home/apt,200,100,60,5,8
Beautiful Back Bay apartment 4 you!,4,10,2,45980822,Carolina,2171,within a few hours,90,0,Apartment,Entire home/apt,200,100,60,1,1125
Spacious Back Back Studio Steps from Public Garden,3,10,3,15338241,Scott,2686,within an hour,100,0,Apartment,Entire home/apt,200,200,50,2,4
Back Bay 1-Bedroom next to Newbury,20,10,2,1538079,Tom,3552,within an hour,100,0,Condominium,Entire home/apt,235,150,30,3,14
Back Bay - Newbury St 1 bedroom,23,9,3,814298,Brent,3718,within a few hours,98,0,Apartment,Entire home/apt,194,500,100,2,1125
1 BR on Newbury St,2,10,3,36275619,Sam,2280,within an hour,100,0,Apartment,Entire home/apt,230,500,30,1,1125
Large 2 BR|2 BA + Patio in Back Bay,30,10,3,9410008,Jason,2895,within an hour,100,0,Apartment,Entire home/apt,375,475,125,3,45
Classic Brownstone in Historic Area,25,10,2,54361238,Emily And Giuseppe,2074,within a few hours,100,0,Apartment,Entire home/apt,350,500,100,3,14
Amazing Newbury St 1 bedroom,7,9,3,814298,Brent,3718,within a few hours,98,0,Apartment,Entire home/apt,259,500,100,2,1125
Back Bay 1BR Apt / Heart of Boston!,103,10,3,10493424,Nicole,2840,within a few hours,100,0,Apartment,Entire home/apt,239,200,75,2,1125
Charming Studio–Heart of Back Bay!,13,9,3,12243051,Flatbook,2771,within a few hours,71,0,Apartment,Entire home/apt,139,400,95,3,1125
Boston's Best Newbury Street Flat!!,19,10,2,23676983,Brooke,2500,within a day,100,0,Apartment,Entire home/apt,225,400,65,2,1125
Beacon Street Loft - Amazing Location,3,9,1,88129265,Jason,1868,within an hour,100,0,Loft,Entire home/apt,100,100,20,1,4
Lovely Back Bay Pearl 1BR,23,10,3,54952385,Vera,2069,within an hour,100,0,Condominium,Private room,109,100,40,2,15
Brownstone in heart of Back Bay,77,9,3,42431392,Frank,2215,within an hour,100,0,Townhouse,Entire home/apt,150,500,80,1,1125
"Marlborough St, steps to Newbury St",2,9,1,62106939,Attuck,2018,within a few hours,100,0,Condominium,Entire home/apt,350,500,100,1,1125
Penthouse in Back Bay,12,10,2,65907845,Douglas,1990,within a few hours,100,0,Apartment,Entire home/apt,281,200,83,4,1125
"Back Bay PH, private roof deck",17,9,3,3137257,Furnished Rentals,3332,within a few hours,97,0,Apartment,Entire home/apt,170,500,125,7,1125
3 BD single family.  Steps to everything w/ Patio!,15,10,2,24196977,Jenny,2486,within a few hours,100,0,House,Entire home/apt,550,1000,85,3,1125
Boston Back Bay/Copley Square,12,9,3,30658962,Marlo,2356,within a few hours,100,0,Apartment,Entire home/apt,325,400,100,3,1125
Back Bay Penthouse 2 Bed with Private Terrace!,3,9,3,814298,Brent,3718,within a few hours,98,0,Apartment,Entire home/apt,150,500,125,2,1125
Back Bay Gem on Commonwealth Avenue,15,9,3,31235595,Brooks,2347,within a day,100,0,Apartment,Entire home/apt,425,500,90,7,1125
The Best Location In Boston,24,9,3,18142992,Jesse,2620,within an hour,100,0,Townhouse,Entire home/apt,199,100,29,1,1125
Back Bay Gem 1,46,10,3,47618394,Liesl,2150,within an hour,100,0,Apartment,Entire home/apt,145,200,60,2,1125
Back Bay Apt - Close and Convenient to Everywhere,11,9,1,6032648,Madison,3070,within an hour,80,0,Apartment,Entire home/apt,200,95,20,2,1125
Classic Back Bay 3 Bed/1 Ba Flat,21,9,3,814298,Brent,3718,within a few hours,98,0,Apartment,Entire home/apt,568,500,125,2,1125
Lofty 2BD w/ Lg Private Roof Deck,10,10,3,8790904,Albert,2926,within an hour,100,0,Apartment,Entire home/apt,250,300,75,2,30
Stunning Back Bay Studio Apartment,1,10,3,39051883,Gretchen,2250,within a few hours,100,0,Apartment,Entire home/apt,189,500,150,13,365
Back Bay 1  Bedroom - Charles River,19,9,1,32540732,Nancy,2328,within an hour,100,0,Apartment,Entire home/apt,200,200,100,1,1125
Everybody's favorite! BACK BAY FENW,26,8,3,21184200,Paige,2563,within an hour,99,0,Apartment,Entire home/apt,207,99,50,1,1125
Perfect Back Bay 1BR; Walk the City,33,10,1,22726574,Nathan,2524,within a few hours,100,0,Apartment,Entire home/apt,259,200,50,2,1125
Adorable 2BR in heart of Boston,33,9,2,17010369,B.J,2646,within a few hours,100,0,Apartment,Entire home/apt,300,150,75,2,4
Private Room in Back Bay Brownstone,35,10,2,9969381,Brady,2865,within an hour,100,0,Apartment,Private room,140,200,50,2,5
A Home In The Heart Of It All,9,9,1,70633440,Nicholas,1959,within an hour,100,0,Apartment,Entire home/apt,176,500,75,4,14
Small Studio in Back Bay - 1st Flr,40,8,1,13765922,Michael,2725,within a day,100,0,Apartment,Entire home/apt,200,100,50,1,30
